headline,text,timestamp
Nightclub survivor recalls 'total chaos' of ceiling collapse that killed 221,"At 01:00 on Tuesday morning Carwin Javie Molleja was dancing with his mother in Santo Domingo's Jet Set nightclub when he noticed something fall from the ceiling.

At the time, he didn't think much of it. ""No-one thought that because a small stone fell the entire roof was going to collapse,"" he says.

The percussionist, who had moved to the Dominican Republic eight years earlier, was out with his mother, Carmin, and friends to see a concert by merengue singer Rubby Pérez.

It was the first time Carwin, 32, and his mother had seen each other in three years and it was meant to be a night of joy and celebration.

But in the early hours of Tuesday morning, disaster struck.

""What I have in my head are the screams, the loud sound of the ceiling falling in, my mom's screams asking me if I'm OK, me asking her if she's OK,"" Carwin recalls.

""Everything happened so fast. I guess I closed my eyes and my instinct was to hug my mum.""

Both Carwin and his mother, who had been standing near the stage, were struck on the head by pieces of falling ceiling, but were lucky to avoid serious injury. Rubby Perez was among those killed.

In the chaos that quickly unfolded, Carwin managed to find a door through which he and his mother escaped outside.

But his friend Jessica and her sister were still in the club. Desperate to find them, he decided to go back inside.

Inside the club, Carwin desperately shouted Jessica's name but no one answered.

He says he felt powerless to help those who had become trapped under the debris.

""The stones were huge. I felt useless.""

Carwin says he then repeatedly went out of the building, where he'd try to call paramedics, then return inside to shout his friend's name and call her phone.

""After that, the calls stopped going through.""

Carwin describes the aftermath of the collapse as ""total chaos"".

""People were going crazy,"" he says.

""They were pulling out injured people. I saw when they pulled out the saxophonist who died.""

Within minutes of the collapse, emergency services arrived, as ambulances and stretchers ""kept coming"".

Carwin says he remained at the scene for about an hour and a half after the collapse.

In that time, he says he didn't see any machinery arriving to remove the debris.

He says he wanted to continue trying to find his friend, but needed to take home his mother, who was in pain.

""I needed to get her home and calm her down.""

Later that day, Jessica and her sister's lifeless bodies were found among the rubble. At least 221 people were killed in the disaster.

Carwin says he regrets not having been able to do more for his friend.

""It was horrible not being able to help her. I yelled her name, but she didn't answer. It feels awful not being able to do anything.""

With reporting by Isabel Caro and Alicia Hernández.",2025-04-11T12:37:05Z
Euphoria star Eric Dane diagnosed with ALS,"Euphoria and Grey's Anatomy star Eric Dane has revealed he has been diagnosed with amyotrophic lateral sclerosis (ALS), the most common form of motor neurone disease (MND).

Speaking to People, the 52-year-old US actor said he was ""grateful to have my loving family by my side as we navigate this next chapter"".

""I feel fortunate that I am able to continue working and am looking forward to returning to set of Euphoria next week,"" he added, while asking for privacy for himself and his family.

Dane stars as the Jacobs family patriarch Cal Jacobs on hit HBO teen drama show Euphoria, which is due to begin production on season three on Monday.

Before that, he was perhaps best known as Dr Mark Sloan on Grey's Anatomy from 2006.

He also played Jason Dean in fantasy drama series Charmed, and Captain Tom Chandler in action drama show The Last Ship, while appearing in films such as Marley & Me, Valentine's Day and Burlesque.

He is married to fellow actress and model Rebecca Gayheart, and the couple have two children.

According to the NHS, MND ""encompasses several different conditions whose common feature is the premature degeneration of motor nerves (known as neurons or sometimes neurones)"".

It says nearly 90% of patients with MND have the mixed ALS form of the disease.",2025-04-11T12:37:05Z
"'We collected his body instead of celebrating Eid,' says mother of Gaza medic killed by Israel","""My heart and soul died when Rifaat was killed,"" says Hajjah Umm Mohammed, the mother of a Palestinian paramedic who was one of 15 emergency workers killed by Israeli troops in southern Gaza last month.

Rifaat Radwan, 23, was travelling in a Palestinian Red Crescent Society (PRCS) ambulance in a convoy of emergency vehicles when it came under fire on the outskirts of Rafah on 23 March.

""I never expected him to be killed, especially since the area was classified as 'green', meaning safe and open to ambulances,"" she adds.

The Israeli military initially claimed the troops opened fire because the convoy approached them ""suspiciously"" in darkness without headlights or flashing emergency lights.

However, video filmed by Rifaat and found on his phone after his body was recovered, showed the vehicles' lights were on as they answered a call to help wounded people.

""Forgive me, mother... this is the path I chose to help people,"" Rifaat can be heard saying in the video shortly before he was killed, amid the sound of heavy gunfire.

Umm Mohammed believes he was asking for her forgiveness because he knew she would never see him again.

""I entrusted Rifaat to God every time he went out to work,"" she says. ""He was brave, travelling across Gaza from north to south.""

Rifaat began volunteering with the PRCS after Israel launched a military campaign in Gaza following Hamas's unprecedented cross-border attack on 7 October 2023.

Umm Mohammed says her son enjoyed humanitarian work.

""He even transported the wounded to cross into Egypt for treatment through the Rafah crossing.""

Umm Mohammed explains that on the day he died, Rifaat had gone out with an ambulance after reports of several killed in an Israeli air strike.

""I didn't know he would be one of them [too],"" she says.

It was a week before his body and those of his colleagues were found buried in a shallow grave on 30 March.

""Instead of celebrating Eid al-Fitr with Rifaat, we went with the Red Cross to collect his body from Nasser hospital in Khan Younis to bury him,"" she recalls.

""It was badly decomposed and they wouldn't allow me to see it.""

Umm Mohammed says he was an ""absolutely beautiful"" human being and the sole supporter of her and his father after all his siblings got married.

Following the discovery of the video footage, an Israeli military official changed its initial account that claimed the vehicles approached without their lights on. The official said the person who gave the account was ""mistaken"".

The official also said the troops perceived the emergency workers as a threat because of an earlier encounter in the area, and that at least six of those killed were Hamas operatives, without providing any evidence.

The troops buried the bodies, including Rifaat's, in sand to protect them from wild animals, the official said.

They were not uncovered until a week after the incident because international agencies, including the UN, could not organise safe passage to the area or locate the spot.

When the UN-led team found the bodies they also discovered Rifaat's mobile phone containing footage of the incident.

The Israel Defense Forces (IDF) has promised a ""thorough examination"" of the incident, saying it would ""understand the sequence of events and the handling of the situation"".

The PRCS has alleged that the emergency workers were targeted in a ""series of deliberate attacks"" which constituted a ""full-fledged war crime"", and demanded an independent international investigation.

""We need justice for the victims. We need to ensure that all of those who are responsible are held to account. Without this, the crimes will continue to happen,"" PRCS spokeswoman Nebal Farsakh said on Wednesday.

""I have already lost 27 PRCS colleagues. All of them were killed while doing their humanitarian work. All of them were killed while wearing the Red Crescent emblem. This is not acceptable. It should never, ever have happened. We are not targets. And international humanitarian law is clear – humanitarians, medical personnel should be respected and protected.""

Munther Abed, a paramedic who survived the incident, says he and his colleagues were fired at without warning.

""I dropped to the floor in the back of the vehicle and didn't hear any sound from my colleagues except their death gasps,"" he told the BBC last week.

""Then, Israeli special forces arrested me, pinning my head to the ground so I couldn't see what happened to my team.""

Holding back tears, Munther added: ""When I found out they were all martyred, it crushed me. They were my second family... my brothers, my friends, my loved ones.

""I wished I had died from the horror of what I saw.""

He says his phone was confiscated when he was detained.

""They interrogated me for 15 hours with beatings, insults, and both physical and verbal torture,"" he adds.

The BBC has put his claims to the IDF, but it is yet to respond.

The PRCS said the area the emergency workers were in had not been classified by the Israeli military as a ""red zone"", which meant no prior co-ordination was required to access the site, and that the video showed that Israeli military vehicles had not been visible in the area.

It said preliminary forensic reports showed that the paramedics were killed by ""multiple gunshot wounds to the upper parts of the bodies"", which it described as ""further evidence of deliberate killing"".

It also dismissed the IDF's internal inquiry and rejected the IDF's accusation that Hamas operatives were among those killed.

The IDF said in a statement on Monday that its Chief of Staff, Lt Gen Eyal Zamir, had been presented with the findings of the initial inquiry into the incident and instructed that it be ""pursued in greater depth and completed in the coming days by the general staff investigation mechanism"".

""All the claims raised regarding the incident will be examined through the mechanism and presented in a detailed and thorough manner for a decision on how to handle the event,"" it added.

About 1,200 people were killed and 251 were taken hostage in the Hamas attack on Israel on 7 October 2023.

More than 50,750 people have been killed in Gaza since then, according to the territory's Hamas-run health ministry.

A ceasefire deal announced in January collapsed in March and there are currently 59 hostages still held in Gaza, 24 of whom are believed to be still alive.",2025-04-11T12:37:05Z
Gabon holds its breath as coup mastermind eyes presidency,"Every day, 40-year-old Landry Obame-Mezui drives a taxi in Gabon's capital Libreville.

But it's not just any taxi. It's a sparkling, brand-new white car with the inscription ""Taxi Gab+"".

For Mr Obame-Mezui, it is a shining symbol of a promise to Gabon's youth from coup mastermind-turned-transitional leader Gen Brice Oligui Nguema, who has ruled since August 2023.

With 40% of young people out of work, Oligui Nguema has offered more than 800 new vehicles to young people through a hire purchase scheme.

Mr Obame-Mezui used to drive a taxi owned by someone else. He says, thanks to the interim leader, he now has a better chance of becoming an entrepreneur.

""Before August 30 [2023], things weren't going as I wished, but today I have something stable on which I can set objectives and go far,"" he says, leaning on his new car.

It is no secret who the taxi driver will vote for in Saturday's presidential election - ""I will vote for the builder Oligui Nguema"" says the slogan on his car roof.

""The president came in with a new way of doing things – action before speeches,"" he says, predicting a ""crushing victory"" at the polls.

Little more than 19 months after the bloodless coup that brought an end to more than five decades of rule by the Bongo family, the people of Gabon are about to head to the polls to choose a new head of state.

Across the capital, there is no secret about who controls the country.

In varied shapes, sizes and designs, billboards and campaign posters of race favourite Oligui Nguema cover the city.

They dominate the airport, markets and neighbourhoods, leaving very little room for the opposition.

""It's just for the ambiance,"" says Shonnys Akoulatele a potential voter who believes there is more to governance than displaying campaign posters.

With little enthusiasm for the campaign, the 30-year-old says she will only vote out of a sense of duty because none of the eight candidates appear to be able to truly transform the country.

""We're merely seeing a monotony of the previous regime,"" says Ms Akoulatele, adding that presidential candidates are former allies of ex-President Ali Bongo.

Alain Claude Bilie-by-Nze, the main challenger in the polls, served as prime minister both under late president Omar Bongo and his son Ali Bongo.

Other aspirants such as Stephane Germain Iloko and Alain Simplice Boungouères were also influential members of the former ruling PDG party.

But all candidates seem keen to distance themselves from the old regime.

Front-runner Oligui Nguema served both Bongo father and son, but now emphasises his role in leading the coup that ousted the Ali Bongo.

He is making the fight against corruption, money laundering and embezzlement a central part of the country's transition to democracy - including arresting the ex-president's wife and eldest son and accusing them of illegally enriching themselves, which they deny.

On the campaign trail, he boasts of the roads, hospitals and schools being built under his tenure, promising further projects if elected as president.

Not everyone is convinced.

""The transition was something I loved from the start,"" says Libreville resident Jacques Okoumba.

""I appreciated what they were doing, but after several months I realised not everything promised during the transition actually materialised.""

After voting for a new constitution in a referendum in November 2024, many believed Saturday's election would signal the official end of the Bongo dynasty.

Oligui Nguema's supporters thought it would complete the work he started with his so-called ""liberation coup"" a year earlier, ending five decades of corruption scandals, rights abuses and alleged repression.

But political analysts like Bergès Mietté say they doubt how authentic that change is, arguing that political transition is truly valid ""when there is a renewal of the political class and method of governance"".

""Looking at the current situation, there's almost no renewal of the elite, because those in power now were part of the previous regime, be it that of Bongo the father or Bongo the son,"" he says.

For most Gabonese, this election is a chance to right some of the wrongs  they suffered under the previous regime.

For the first time since 1967, the country will go to the polls without a Bongo or the PDG party on the ticket.

Critics say the new constitution and electoral code were designed to favour Oligui Nguema, because they did not bar the former military officer from running and they introduced age limits which meant older opposition leaders could not challenge him.

But others have dismissed this claim, attributing any potential victory to the fact that Oligui Nguema has no strong competition.

Additional reporting by Gift Ufuoma in Libreville

Go to BBCAfrica.com for more news from the African continent.



Follow us on Twitter @BBCAfrica, on Facebook at BBC Africa or on Instagram at bbcafrica",2025-04-11T12:37:05Z
Indian man who fed water to cheetahs in viral video restored in job,"An Indian forest worker, who was suspended after he was seen offering water to a cheetah and her cubs in a viral video, has been restored in his job at the sanctuary.

Satyanarayan Gurjar, a driver at the Kuno National Park in Madhya Pradesh state, violated instructions which said only authorised personnel could go near the big cats.

Cheetahs became extinct in India in 1952 but they were reintroduced in Kuno in 2022 as part of an ambitious plan to repopulate the species.

""I was suspended but have now been reinstated,"" Mr Gurjar told BBC Hindi. ""I am thankful to the authorities,"" he said, adding that the region's top forest official was incensed at his act.

Forest officials confirmed his reinstatement after protests by members of his community. Since this was his first offence, forest officials said they let him go with a warning, telling him that if he encountered an animal in distress in future, he should contact the authorities and not intervene himself.

The viral footage surfaced on Sunday with a video showing him pouring water into a metal pan, urged by off-camera voices. Moments later, a cheetah called Jwala and her four cubs drink from it.

Mr Gurjar said he was not at fault and blamed those who made the videos viral.

Referring to the cheetah and her cubs in the video, he said, ""I called her by her name, saying 'Jwala come, Jwala come'. They come only when you call them by their names.""

While initial reports called the video ""heart-warming"" and praised Mr Gurjar for his ""kindness"" and ""bravery"", many on social media raised safety concerns and urged authorities to create water sources within the park to prevent such encounters.

Mr Gurjar says he isn't afraid of wild animals as his ancestors have lived in forests for generations.

""I can sense the feelings of 99% of animals just by looking at them. I could immediately sense that the cheetah and her cubs were thirsty and I offered them water,"" he said.

Officials say staff sometimes offer water to big cats near park boundaries to lure them back into the forest.

Chief Conservator of Forests Uttam Kumar Sharma said earlier that only trained personnel wre allowed near cheetahs to guide them back and avoid conflict. The man's actions violated protocol, which clearly instructs staff to keep their distance, he added.

Mr Gurjar also has some advice about what to do if you encounter a big cat. ""If you ever face a cheetah, speak to it with love - don't hit it or throw stones,"" he said.

Between 2022 and 2023, 20 cheetahs were relocated from South Africa and Namibia to Kuno - the first intercontinental move of its kind.

Since then, eight have died from causes like kidney failure and mating injuries, raising concerns about the park's suitability.

Park authorities deny the allegations, saying 26 cheetahs remain -17 in the wild and nine in enclosures.

India is expected to receive 20 more from South Africa this year.

Follow BBC News India on Instagram, YouTube, X and Facebook",2025-04-11T12:37:05Z
