headline,text,timestamp
Chloe Qisha: Rising pop star finding fame at just the right time,"When Chloe Qisha was training to be a therapist, she wondered whether her dreams of being a pop star would ever come true.

Now, with one of the biggest artists in the US covering her songs and a spot on the BBC Radio 1 playlist, it's definitely happening for the singer even if, in her words, she's ""a little bit late"".

But, speaking to BBC Newsbeat, Chloe says ""late"" actually feels like the perfect time.

The London-based singer, who was born in Malaysia, has been breaking through with her track 21st Century Cool Girl, which she describes as ""an ode to my teenage self"", about the insecurities and drama of teen romance.

Chloe laughs when she says that success has come after her brain had time to ""fully develop"".

""I think if it happened any earlier in my life I would have messed it up for myself,"" she says.

""I'm looking back at my younger self, who was a bit of a trainwreck of a human being, and just being like, 'You've got this, it's gonna work out, it's going to be great'.

""It took a lot of finessing over the years but now this is my whole life and I'm just so excited.

""It feels like what Chloe Qisha was always meant to do.""

Chloe released her first self-titled EP back in November and has been busy releasing new music since.

She confesses her route into music - doing a psychology degree first - was ""a little bit backwards"".

Chloe started writing songs at uni, after posting covers on YouTube inspired her to get deeper into the process.

""I realised I needed to learn how to write songs if I wanted to do this,"" she says.

However, she thinks having the extra time and experience helped to reassure her that music was ""100% the right path"" for her.

But Chloe says her degree in psychology has influenced a lot of her songs, which explore themes of wellbeing.

""It's like learning to accept yourself, learning to accept the insecurities and everything like that,"" she says.

""I'm here as my older self, feeling more set and confident in my mental health,"" she says.

Chloe might have left the textbooks behind as her career takes off, but the learning hasn't stopped, she says, admitting she's still finding out things about being a pop star.

She performed at BBC Introducing's Ones To Watch showcase in January and says being on stage means focusing on more than just the music and the songwriting.

It's also the live performances, filming music videos and adapting to professional choreography as someone better known for ""really terrible dad dancing"".

All that work is worthwhile though, she says, when crowds of fans sing along to her songs.

""It's moments like that you just can't replace.

""It's just so special.""

Critics, as well as fans, are starting to notice with the likes of Rolling Stone and NME dubbing Chloe as an artist to watch.

She has more than 700k monthly listeners on Spotify and when she recently released tickets for her first headline show in London it sold out in four minutes.

And she's made a name on the other side of the world too, being spotted by US singer and chat show host Kelly Clarkson.

The American Idol winner's TV programme features a ""Kellyoke"" segment where she covers other artists.

Usually those songs are by high-profile singers such as Taylor Swift, Ariana Grande and Coldplay.

But in February she picked Chloe's song I Lied, I'm Sorry, just a couple of months after the track was featured as BBC Introducing's Track of the Week.

Chloe says her song being performed on the show is something she still hasn't processed.

""Kelly Clarkson. This almost, fantasy, beautiful, human being,"" says Chloe.

""It just feels surreal, I still think it's a prank.

""It's such an honour, I feel so blessed,"" she says.

Listen to Newsbeat live at 12:45 and 17:45 weekdays - or listen back here.",2025-04-11T12:37:05Z
Weekly quiz: What was special about this baby?,"This week saw the global markets ride a rollercoaster led by Donald Trump's trade tariffs, Madonna bury the hatchet with Elton John, and new details revealed about how the Titanic sank.

But how much attention did you pay to what else has been going on in the world over the past seven days?

Quiz compiled by Ben Fell.

In the mood for more? Try last week's quiz, or have a go at something from the archives.",2025-04-11T12:37:05Z
Will Poulter and Kit Connor: We shaved each other's heads before filming Warfare,"The young cast of Alex Garland and Ray Mendoza’s film Warfare had to bond pretty quickly, to play a US military unit whose lives depended on each other, during the Iraq war in 2006.

Familiarity was crucial, so before filming began, the cast were sent on a three-week military bootcamp.

They lived together, learning military jargon and gun safety and were pushed beyond their limits - all of which brought them closer together.

First off though, they agreed to shave each other's heads to look the part, boosting trust and familiarity.

""We shaved our heads on day one, and got tattoos at the end of the process, so it bookended the experience,"" Poulter tells the BBC.

The actor, who recently appeared in The Bear and Guardians of the Galaxy Vol 3, plays Captain Eric, who was part of a group of US soldiers and Iraqi scouts on a surveillance mission.

We see how it goes wrong, with devastating consequences.

Heartstopper star Connor plays newcomer Tommy, hitting home how young the soldiers were - he's just turned 21, the same age Tommy was at the time.

The actor says the decision to get a shared tattoo with his castmates after filming wrapped was a ""no-brainer"". The casts of The Avengers and The Lord of the Rings did the same thing after their final films.

Warfare's actors decided their tattoo would say ""Call On Me"", to reflect their brotherhood, while referencing Erik Prydz's 2004 dance hit, which kicks the film off.

The cast features some other big names, including Reservation Dogs' D'Pharaoh Woon-A-Tai, Shōgun's Cosmo Jarvis, Stranger Things and the forthcoming Beatles biopic's Joseph Quinn, and Riverdale's Charles Melton.

""It was really formative for me,"" Connor says about his time  on the film. ""I've made friends I really do believe I will know for a long time.

""We all wanted to commemorate it - we are so proud of the work we've done together.""

The movie is based entirely on a real-life mission that took place during the Iraq war, and is built on the memories of the US soldiers who were there.

The group was embedded in the home of an ordinary Iraqi family, who we briefly see in the film, in Ramadi - an area controlled by Al-Qaeda forces.

The military's goal had been to slip into and observe the area under the cover of darkness, to ensure the safe passage of ground forces there the next day.

What they didn't know what that they were next door to an insurgent house, making them the target of an attack.

Shot in real-time, Warfare has no music or flashbacks, so there's no let-up for the audience. You're dropped into the thick of the action for the whole film.

The soldiers in command have to make split-second decisions amid the pain and chaos, with the Iraqi family caught in the crossfire.

Oscar nominee Garland, whose back catalogue includes the 28 Days film franchise and Ex Machina, got the idea for Warfare when he was making last year's film Civil War.

He was working on the battle scenes with Hollywood stunt man and gunfight co-ordinator Ray Mendoza.

""During the edit process of Civil War, I was able to really focus on some of the work Ray had done, and how sophisticated and how nuanced it was,"" Garland recalls.

They got chatting about Mendoza's previous life as a US Navy Seal, and about the Ramadi operation, where he was its communications officer.

Mendoza said he'd always wanted to make a film about that mission.

The veteran had a very big reason for wanting to recreate what happened that day - to help replace the lost memories of his colleague Elliott Miller.

Miller, a former Navy Seal, was so badly injured in Ramadi that he suffered traumatic brain injury and memory loss, and had to have a leg amputated.

During the mission, Mendoza carried the unconscious soldier to the rescue tank that ultimately saved his life.

""Elliott doesn't remember it, and when he woke up, he had a lot of questions,"" Mendoza says.

""No matter how many maps we drew, or how many times we wrote it out - without that core memory, I think he's had a hard time.

""It just raised more questions than answers. So I wanted to recreate this one.""

So Garland and Mendoza decided to make Warfare together, sharing writing and directing credits, and dedicating the film to Miller.

The crucial question is whether seeing the film helped Miller piece things together.

""It did, yeah - he was a sponge,"" Mendoza says.

""We walked him through it - he had a lot of questions, he's got kids that have questions.

""It's now a film memory, but it's as close as he's gonna have – he's super grateful.""

Miller was played by Jarvis, who calls him ""a funny guy... he's great - a living embodiment of perseverance"".

It was a ""unique situation to be in when you're entrusted with portraying somebody that's sitting right across from you"", Jarvis said, about having the person he was playing actually on set.

""But because he didn't remember [what happened], a lot of my references had to come from his colleagues.""

The soldiers' casting has caused some excitement online, with some publications breathily calling the actors ""all of the internet's boyfriends"" and ""red hot rising stars"".

Garland arches an eyebrow at this, and Mendoza jumps in to talk about why those actors were chosen.

""I've said this to them, so I'm not trying to offend them, but we weren't looking for the best actors. They're all great actors. We were looking for the right actors,"" he says.

""So what that means is their willingness to push their bodies past a comfort level that they're maybe not used to. 'You're gonna be exhausted. You're gonna be required to rely on other people. It's not about you, it's about the team'.

""And the ones that jump at that opportunity, you're like, 'Yep, that's the attitude that we need'.""

Collating and cross-checking the soldiers' memories was a big job, largely undertaken by Garland.

""I think there's an inherent value in attempting to be honest and truthful about something as serious and significant as war,"" he says.

He shot the film in a studio in a suburb north of London, on a former World War Two airfield, making it in real-time to recreate ""a real incident of combat... as honestly, forensically and accurately as possible"".

Not surprisingly, while sharing credits with Garland, former US Navy Seal Mendoza ran the actors' bootcamp.

He was played by Woon-A-Tai, who calls him ""a brilliant instructor who instilled a lot of confidence in us"", while also making gun safety a top priority.

The actor was also fascinated by the narrative not being ""dramatised or Hollywoodised"".

""To see these guys not obey orders - and do what they needed to save their platoon was interesting to me,"" he says, talking about the soldiers' evacuation process.

Mendoza thinks the film may also help veterans who are struggling to express what warfare can be like.

""Some of these things are harder to explain in words,"" he says. ""So art imagery is how I'm able to communicate that.""

Connor echoes this, saying: ""A lot of these men are very much less inclined to talk about themselves in these situations, whether it be to be due to humility, or a difficulty in really articulating it.

""A lot of them just don't really enjoy talking about their involvement.""

The film has been called ""the most harrowing – and honest – depiction of modern combat ever made"" by the Telegraph, while the New Yorker said it offers a ""hyperrealist rebuke of the American war movie"".

The Guardian said the ""film-makers' message gets lost in the deafening blizzard of battle"", while Empire added: ""It may well be cinema's most effective, purest anti-war film: there is no sentimentality, no hand-wringing, but most significantly not a second of it makes war look cool, or attractive.""

Poulter says he admires the film-makers' determination to make Warfare purely factual.

""Hopefully this film contributes to a better understanding of just how negative, and how the consequences of war are characterised by a lot of loss...

""I think this is as much an anti-war film as you can possibly hope to see.""

Warfare is out in cinemas on Friday, 18 April.",2025-04-11T12:37:05Z
Schools in Beirut suburb fear return to war after new Israeli strikes,"It was a typical Friday lunchtime in Beirut's southern suburb. Then, a single warning, posted in Arabic on X by a spokesperson for the Israel Defense Forces (IDF), triggered panic and chaos in the densely populated area known as Dahieh.

""Urgent warning to those in the southern suburb of Beirut,"" it read. The post included a map of a residential area, marking a building in red and two nearby schools. The IDF identified the building as a Hezbollah facility, and ordered the immediate evacuation of the schools.

An air strike was imminent.

What followed were scenes of sheer panic. Parents rushed towards the threatened area to collect their children from the schools, while residents fled in the opposite direction, visibly shaken and fearful.

""It was total chaos,"" recalls Ahmad Alama, the director of St Georges School, one of those highlighted on the map. ""We tried to contain the situation as much as we could, but it was crazy.""

The area was soon cleared, and Israeli forces destroyed the marked building, which they said was a warehouse storing Hezbollah drones.

The strike, carried out two weeks ago, was the first on Dahieh – an area with a strong Hezbollah presence – since a ceasefire ending the war between Israel and Hezbollah took effect last November.

It came hours after two rockets were launched from southern Lebanon towards northern Israel. Israel said it intercepted one rocket, while the other fell short of the border.

Hezbollah, the Iran-backed militant and political group, denied involvement. Israel described the rocket fire as a ceasefire ""violation"", while the office of Lebanon's president, Joseph Aoun, condemned the Israeli strike as a ""violation of the agreement"".

""We thought the war had ended with the ceasefire,"" says Mr Alama, ""But unfortunately, we're still living it every day.""

Despite the ceasefire, Israel has continued near-daily strikes on people and targets it says are linked to Hezbollah, saying it is acting to stop Hezbollah from rearming. The strikes have mainly occurred in southern Lebanon, but the recent bombings in Dahieh have sparked particular alarm.

On 1 April, a second Israeli strike hit the area – this time without warning – killing a Hezbollah commander and three other people, according to the Lebanese health ministry.

Mr Alama has been running St Georges School for 30 years. It serves around 1,000 children of all ages, boys and girls. Although religion is part of the curriculum for older pupils, he describes the school as secular.

It is also well-known in the community for its association with the Lebanese pop star and talent show judge, Ragheb Alama – Ahmad Alama's brother and the school's owner.

The recently destroyed building lies just metres from the school. It isn't the only nearby scene of devastation. Another building, opposite one of St Georges' gates, remains a massive pile of rubble – brought down by Israeli air strikes before the ceasefire.

During the war, the schools were closed. They didn't have to deal with situations such as the one they faced. Now reopened, they are braced for the possibility of more bombing.

The school has devised evacuation plans, designating emergency meeting points in the basement and routes for pupils and staff to follow in case of any danger.

There are also new communication plans with parents to prevent a repeat of the chaos of last month's strike. Children are now routinely reminded of these procedures, with regular evacuation drills.

Students, staff, and parents alike are traumatised by what happened, Mr Alama says.

Initially, the school considered cutting back on extracurricular activities to make up for lost learning, but they changed their minds.

""We decided otherwise,"" Mr Alama says. ""Pupils shouldn't pay the price for something they aren't responsible for. We've actually ended up increasing these activities – these kids need to release some of the pressure on them.""

Nearly five months into the ceasefire, the return of Israeli air strikes to Beirut has intensified fears of a return to all-out war.

The ceasefire was meant to end more than 13 months of conflict between Israel and Hezbollah, which began when Hezbollah launched attacks on Israeli military positions the day after the Hamas attacks on southern Israel on 7 October 2023, saying it was acting in solidarity with Palestinians in Gaza.

The conflict escalated in September 2024, when Israel launched a devastating air campaign across Lebanon and invaded the south of the country.

Dahieh, deserted during the war, is bustling again. Shops have reopened, hookah smokers are back at crowded cafes, and the suburb seems as busy as before, with its persistently paralysing traffic.

But amid these signs of normality, scenes of destruction serve as a reminder of the pounding this area endured just months ago.

Some 346 buildings in the area were destroyed and another were 145 partly damaged by Israeli air strikes, according to a municipal official. Israel said it targeted Hezbollah facilities and weapons caches.

In many neighbourhoods, the rubble is still being cleared. The roar of bulldozers and jackhammers drilling into piles of debris is almost constant.

Some of the mounds of debris have Hezbollah flags planted on top of them, while large and small portraits of Hassan Nasrallah, the former Hezbollah leader killed by Israel during the war, line the roads.

However, amid the customary signs of defiance, many are now expressing a deep concern not always voiced – at least in front of cameras – by residents of Dahieh.

""The destruction is terrifying. I see the destroyed buildings and I cry,"" says Sawsan Hariri, the headteacher of Burj High School, also in Dahieh.

The school, which also sits opposite a flattened building, sustained damage from nearby strikes.

""It's depressing. Walking on the street, driving your car - it's all just depressing.""

Ms Hariri used to live on the top floor of the school building with her husband and daughter, but their home has been destroyed. They now rent a flat nearby.

Before the war, Burj High School had around 600 pupils. Now, it has barely 100.

Many parents are reluctant to send their children back amid the scenes of destruction and the constant buzz of machinery. Others were concerned about the health risks, with thick dust still filling the air.

After the ceasefire, owners of the private school made some basic repairs at their own expense.

Hezbollah, which is banned as a terrorist organisation in many countries but in Lebanon is a political and social movement as well as a paramilitary force, has given those who lost their homes $12,000 for a year's rent and has offered to cover the costs of repairs to apartments. However, schools and other institutions have not received any aid.

The Lebanese government has pledged to set up a reconstruction fund, which the World Bank estimates will cost $11bn nationwide. But international donors are believed to be insisting on the disarmament of Hezbollah and political reform – conditions that appear a distant prospect.

Though the clearing of rubble is expected to be over by the end of the year, few expect large-scale rebuilding to follow anytime soon.",2025-04-11T12:37:05Z
"Israeli army fired more than 100 shots in Gaza medics' killing, audio suggests","Israeli troops fired more than 100 times during an attack in which they killed 15 emergency workers in Gaza, with some shots from as close as 12m (39ft) away, a forensic audio analysis of mobile phone footage commissioned by BBC Verify has found.

Two audio experts examined a 19-minute video authenticated by BBC Verify, showing the incident and the moments leading up to it near Rafah on 23 March.

The findings support a claim made by the Palestinian Red Crescent that the workers were ""targeted from a very close range"". On 5 April an Israeli army official said aerial footage showed troops opening fire ""from afar"".

The Israel Defense Forces (IDF) declined to comment on the analysis directly when approached by BBC Verify.

A spokesperson said it was investigating the attack and repeated claims that six of the people killed were linked to Hamas, without offering evidence. The Palestinian Red Crescent rejected the allegation, as did a ninth paramedic who survived and was detained by the IDF for 15 hours.

The Palestinian Red Crescent said the full video was recovered from the phone of a medic killed and buried in a shallow grave by the IDF.

Video filmed by medic Rifaat Radwan who was killed in the incident showed the convoy driving at night, using headlights and flashing emergency lights. At least one medic can be seen wearing a high-vis jacket.

Faced with this, the Israeli army changed its account, admitting that its initial statement that the convoy approached ""suspiciously"" with its lights off was inaccurate.

Experts told BBC Verify they used sound waveforms and spectrograms to measure the distance of the gunfire from the microphone of the mobile. Shortened time gaps indicate that the distance between the microphone and the gunfire decreased as the video progressed.

They concluded that the first shots were fired from around 40m to 43m away. But towards the end of the video, gunfire came from around 12m away.

At a briefing on 5 April, an IDF official told reporters that surveillance showed the troops were at some distance when they opened fire, adding: ""It's not from close. They opened fire from afar.""

One military expert told BBC Verify that any engagements under 50m to 100m would be considered as being within close range.

Robert Maher, an audio forensics expert at Montana State University, said towards the start of the footage one firearm is discharged about 43m away from the mobile phone.

Mr Maher and another expert, Steven Beck, independently corroborated one another's view that in the final few moments of the audio, shots are fired as close at 12m away.

Mr  Beck, a former FBI consultant who now runs Beck Audio Forensics, said: ""The shooter(s) at these times is much closer, with distances of 12m to 18m.  There is a strange pop sound that may be a tire hit by a bullet.""

He added: ""The shockwaves indicate that the bullets are passing close to the recorder microphone - meaning they are being shot at.""

Chris Cobb-Smith, a former British Army officer with over 20 years experience in conducting investigations in conflicts zones, said that at 50m the Israeli troops would have ""definitively been able to identify the convoy as humanitarian"" and would have been able to ""determine that the personnel were unarmed and not posing a threat"".

Voices can also be heard towards the end of the recording, shouting in Hebrew: ""Get up,"" and: ""You (plural) go back"".

Over the period of more than five minutes, at times, multiple firearms were in use simultaneously, the audio experts determined.

Mr Maher said ""the sounds are often overlapping in such a way that it is clear multiple firearms are in use at the same time"".

Because of the overlap of gunshots, Mr Maher said it's difficult to identify individual shots. But both experts determined independently that there were more than 100 shots.

Our audio analysts could not comment on which weapons were being used but Mr Beck said there are ""several bursts of fully automatic gunfire"".

A bullet travelling at supersonic speed first creates a sonic boom - often called a ""crack"". The sound of the bullet being fired is what creates a second sound, often called a ""pop"".

At close distances, the two sounds are almost indiscernible to the human ear.

But by looking closely at the waveform of the audio, the two sounds can be detected and the distance between them measured.

What Mr Maher describes as ""crack-pop sequences"" are visible in these waveforms.

Mr Maher said the further away the firearm is from the microphone, the longer the gap between the two sounds.

Mr Maher said: ""The first few audible gunshots have a crack-pop timing of about 72ms.  Assuming a bullet speed of 800 m/s and speed of sound 343 m/s, that time gap implies the firearm was about 43 meters away.  If the bullet speed were actually faster, that would move the firearm estimate closer to the microphone.""

There are limitations to their estimates. For example, analysts told us they cannot be certain of the type of firearm used or of the miss distance, which is how far off the shot is from the intended target. They also must make an assumption about the average speed of the bullet.

BBC Verify will continue to investigate this incident.

Additional reporting by Thomas Spencer.

What do you want BBC Verify to investigate?",2025-04-11T12:37:05Z
