headline,text,timestamp
Trump had five tariff goals - has he achieved any of them?,"Donald Trump announced a massive tariff plan last week that would have upended the global economic order as well as long-established trading relationships with America's allies.

But that plan - or at least a significant part of it - is on ice after the president suspended higher tariffs on most countries for 90 days while leaning into a trade war with China.

So with this partial reversal, is Trump any closer to realising his goals on trade? Here's a quick look at five of his key ambitions and where they now stand.

WHAT TRUMP SAID: For decades, our country has been looted, pillaged, and plundered by nations near and far, both friend and foe alike

Trump's original trade plan packed a big punch that landed around the world, with a flat 10% baseline tariff on everyone (including some uninhabited islands) and additional ""reciprocal"" tariffs on the 60 countries that he said were the worst offenders.

It sent allies and adversaries scrambling, as they stared down the prospect of a debilitating blow to their economies.

The White House has been quick to boast about all the world leaders who have reached out to the president to make deals and offer trade concessions – ""more than 75"", according to Treasury Secretary Scott Bessent.

Although the administration hasn't released a list of all the countries that Trump said on Tuesday were ""kissing my ass"" and promising to do anything, the US has announced it is in negotiations with South Korea and Japan, among others.

THE TAKEAWAY: America's trading partners have 90 days to strike some sort of agreement with Trump, and the clock is ticking. But the fact that talks are happening indicates that the president has a good chance of getting something for his efforts.

WHAT TRUMP SAID: Jobs and factories will come roaring back into our country…We will supercharge our domestic industrial base.

Trump has said for decades that tariffs are an effective way of rebuilding America's manufacturing base by shielding it from unfair foreign competition. While some factories may be able to increase production in current facilities, more substantive efforts take time. And for business leaders to pull the trigger on ""reshoring"" their production lines and investing in new US factories, they will want to know that the rules of the game are relatively stable.

The president's on-again, off-again tariff moves over the past week are inherently unstable, however. For the moment, it's difficult to predict where the final tariff levels will land and which industries will receive the greatest protections. It could be car manufacturers and steel producers today, and high-tech electronics companies tomorrow.

THE TAKEAWAY: When tariffs are applied and removed seemingly at the president's whim, it's much more likely that companies – both in the US and abroad – will hunker down and wait for the dust to settle before making any big commitments.

WHAT TRUMP SAID: I have great respect for President Xi of China, great respect for China, but they were taking tremendous advantage of us.

After Trump's tariff about-face on Wednesday, several White House officials – including Treasury Secretary Bessent - were quick to say that Trump's goal was to drop the hammer on the real villain, China.

""They are the biggest source of the US trade problems,"" Bessent told reporters, ""and indeed they are the problem for the rest of the world.

If Trump wanted a battle of wills with China, testing each side's tolerance for economic and political pain, he got one – even if the president and his aides have hinted that they are looking for an exit ramp.

On Wednesday, Trump said that he blamed past US leaders, not China, for the current trade dispute. The prior day, White House press secretary Karoline Leavitt said the president would be ""incredibly gracious"" if China reaches out to make a deal.

THE TAKEAWAY: Even if this showdown is one Trump wants, picking a fight with the second-largest economy in the world, with military power to match, comes at enormous risk. And along the way America may have alienated the allies it needs most in such a confrontation.

WHAT TRUMP SAID: Now it's our turn to prosper, and in so doing, use trillions and trillions of dollars to reduce our taxes and pay down our national debt, and it'll all happen very quickly.

During last year's presidential campaign, Trump regularly touted that his proposed tariffs would bring in vast sums in new revenue, which the US could then use to shrink its budget deficit, fund tax cuts and pay for new government programmes.

A study last year by the nonpartisan Tax Foundation estimated that a 10% universal tariff – which is what Trump has landed on for at least the next 90 days – would generate $2tn in new revenue over the next 10 years.

To put that in context, the tax cuts Congress recently included in its non-binding budget blueprint would cost approximately $5tn over the next 10 years, according to the Bipartisan Policy Center.

THE TAKEAWAY: Trump wanted more tariff revenue, and if he sticks with his baseline tariffs, plus the additional levies on certain imports and larger ones on China, he's going to get it – at least until Americans switch to more domestic production, when the tariff money gusher could turn to a trickle.

WHAT TRUMP SAID: Ultimately, more production at home will mean stronger competition and lower prices for consumers. This will be indeed the golden age of America.

Analysts and experts have offered a grab bag of other explanations about why Trump made such an aggressive move on trade last week. Was he trying to drive down interest rates, or devalue the US dollar or bring the world to the table for a new, global agreement on trade? The president himself hasn't spoken much about those kinds of elaborate schemes.

One thing he has talked about relentlessly, however, is his desire to lower costs for American consumers - and he has promised that his trade policy will help address this. While energy prices dipped in the week since Trump announced his tariff plan, that may have been a result of fears that the trade wars could trigger a global recession.

The consensus among economists is that new tariffs will drive up consumer prices, as tariffs are tacked on to the price of imports and, eventually, when there is less competition for US-made products. Last year, the Tax Foundation estimated that a 10% universal tariff would increase costs for American households by an average of $1,253 in its first year. Economists also warn that lower-income Americans will be hardest hit.

THE TAKEAWAY: An increase in prices is an arrow moving in the wrong direction – and it represents an enormous potential liability for both Trump's political standing and his party's future electoral prospects.

Follow the twists and turns of Trump's second term with North America correspondent Anthony Zurcher's weekly US Politics Unspun newsletter. Readers in the UK can sign up here. Those outside the UK can sign up here.",2025-04-11T12:37:05Z
"Trump may have backtracked, but this is far from over","There were some heroic efforts from Donald Trump and those around him on Wednesday night to suggest the past seven days were something other than absolute chaos.

By this reading, Trump's 4D game of chess has left China in check. Certainly the Chinese economy faces a massive hit from punitive tariffs in its biggest market. But even accounting for the President's roll back, the US has still erected a massive protectionist tariff wall, not seen since the 1930s.

The world is left with a universal 10% tariff, irrespective of whether that country (for example the UK or Australia) actually sells less to the US than the US sells to it.

There is now no difference between the EU, which clearly does have a massive trade deficit in goods and was preparing to retaliate, and the UK.

There is also an anxious wait to find out what comes next. One of the questions is whether President Trump pushes ahead with tariffs on medicines, the UK's second biggest goods export.

Plus there is potential logistical chaos on the cards from a little-noticed multi-million dollar port tax for every cargo vessel docking in the US that was ""made in China"". That is more than half of the global merchant fleet - and it is due next week.

Even with Trump's stated 90 day pause on implementing higher tariffs, there remains too much uncertainty for companies to go through the rigmarole of rerouting global trade.

The central issue now, however, is that the world's two great economic superpowers are facing off against each other like rutting stags.

Tariffs at these sky-high rates are massively hitting business between two nations which together account for around 3% of the entire world's trade. The main motorway of the global economy is effectively shut.

The visible tangible consequences of all this will become very real very quickly: Chinese factories will close, workers will stroll from plant to plant looking for work.

Beijing will need to organise a stimulus package to account for the loss of whole percentage points of GDP, the kind of thing that happens when a natural disaster flattens a major city. Painful, but manageable at a cost, though not forever.

Meanwhile the US will see consumer prices surge. President Trump might try to order these US companies not to raise prices, but the effect will come through soon enough.

In theory this will be in sharp contrast to what is happening in other countries in the world. Across the border in Canada, or in Europe, not only will there not be such China-sourced price rises, there could be price cuts.

Trade wars on this scale do not stay confined to the flow of goods. They tend to become currency wars.

What we saw this week was the trade turmoil spread to credit markets, especially the US bond market, having already hit share prices.

Indeed there was an invaluable reveal for the game theory of this conflict. The Trump administration revealed a key pressure point with its concern about the ""yippy"" - as Trump called it - bond market.

As trading in US government debt continued overnight in Asia, the effective interest rate on these bonds rose to 5%.

This sort of borrowing should not move in such an erratic fashion.

The last time this happened was in the ""Dash for Cash"", the key moment of financial fragility at the very beginning of the pandemic. The world was focussed on life or death in March 2020, but this potential further crisis was alleviated only by emergency action.

Effectively, the President's row back was a form of emergency policy change.

Was the Chinese government behind this rash of US government bond sales in Asia? Probably not. However, what happened on Wednesday highlighted a vulnerability for Trump.

China is the second biggest holder of US government debt in the world and if it chose to, dumping all that debt would be catastrophic for America. But doing so would be a form of mutually assured economic destruction - the losses for China would be huge.

More importantly, what the bond markets were telling Trump is that they are deeply sceptical about his tariff policy.

The US does have the Federal Reserve, which does have some power to tranquillise bond markets. But right now it does not look like its chairman Jerome Powell will ride to the rescue.

The bond market scepticism echoes the sentiment of the ascendant Treasury Secretary Scott Bessent. He is now pushing for Trump to reach trade deals with their allies because the US needs them to take on China.

Given the US was previously calling these same close allies cheaters, looters and pillagers, there is no way this was the strategy all along.

This does matter. The US needs the EU, UK, the rest of the G7 on side in terms of China. China probably needs those countries just to stay neutral, and carry on soaking up its exports.

The rest of the world has seen Trump's team struggle to explain tariffing penguin islands or poor African economies and the President himself recirculating the suggestion he was crashing stock markets on purpose. And they've witnessed the fact that the tariff rates were changed after they came into effect and also the absurd nature of the equation used to calculate them.

It's in this context that Trump's handling of the situation has handed leverage back to the rest of the world, because neither friend nor foe will know quite what they are negotiating  with this America.

There is a calm, welcomed by all, but it could be rather brief.

BBC InDepth is the home on the website and app for the best analysis, with fresh perspectives that challenge assumptions and deep reporting on the biggest issues of the day. And we showcase thought-provoking content from across BBC Sounds and iPlayer too. You can send us your feedback on the InDepth section by clicking on the button below.",2025-04-11T12:37:05Z
Will trade-shy India gain edge in tariff-driven slowdown?,"India is the world's fifth-largest and fastest-growing major economy.

Yet, a recent legacy of protectionism and inward-focused trade policies have held back its global competitiveness.

Its tariffs are high and the share of global exports remains under 2%. India's vast domestic market has fuelled its growth - outpacing many others, economists argue, largely because the rest of the world is slowing. But in a turbulent, increasingly protectionist era, India's instinct for self-reliance may oddly serve as a short-term shield.

As countries scramble to recalibrate in response to shifting US trade policies -  like Donald Trump's latest 90-day tariff pause after weeks of sabre-rattling - India's relative detachment may have helped it weather shocks that have jolted more trade-dependent economies.

""India's lower exposure to global goods trade could work in our favour. If export-driven economies slow down under tariff pressure, and we continue growing at 6%, we'll start looking stronger by comparison - especially with our large domestic market to fall back on,"" says Rajeswari Sengupta, an associate professor of economics at Mumbai-based Indira Gandhi Institute of Development Research.

""Being trade-shy has turned into an advantage - but we can't afford complacency. To seize new opportunities, India must stay nimble and open up more to trade gradually and strategically,"" she adds.

It may not be easy, given India's long and complicated relationship with trade barriers and tariffs.

In his book India's Trade Policy: The 1990s and Beyond, Columbia University economist and noted trade expert Arvind Panagariya traces the complex and often inconsistent evolution of India's approach to trade.

During the inter-war years, industries like textiles and iron and steel lobbied for - and received - high levels of protection. The chronic shortages of World War Two led to even stricter import controls, enforced through an elaborate licensing system.

While Asian peers such as Taiwan, South Korea and Singapore shifted to export-led strategies in the 1960s - and began posting impressive growth rates of 8–10% annually - India chose to double down on import substitution. As a result, imports as a share of GDP shrank from 10% in 1957–58 to just 4% by 1969–70.

By the mid-1960s, India had banned imports of consumer goods altogether. This not only removed the pressure on domestic producers to improve quality but also denied them access to world-class inputs and technology.

As a result, Indian products lost their competitiveness in global markets and exports stagnated. The resulting foreign exchange shortages led to even tighter import controls, creating a vicious cycle that stifled growth. Between 1951 and 1981, per capita income grew at a sluggish pace of just 1.5% a year.

The turning point came in 1991. Faced with a balance-of-payments crisis, India dismantled many import controls and let the rupee depreciate - a move that gave a much-needed boost to exporters and domestic producers competing with imports. Import licensing on consumer goods ended only in 2001, after the World Trade Organisation (WTO) ruled against it.

The impact was striking: between 2002–03 and 2011–12, India's exports of goods and services surged six-fold, soaring from $75bn to over $400bn.

With trade liberalisation and other reforms, India's per capita income grew more in the first 17 years of the 21st Century than it did throughout the entire 20th Century, notes Prof Panagariya.

But the pushback to trade didn't end.

Trade liberalisation in India was reversed twice - in 1996–97 and again since 2018 - with extensive use of anti-dumping measures to block imports from the most competitive sources, according to Prof Panagariya.

""Many post-colonial states like India harbour a deep-rooted suspicion that international commerce and trade are simply new forms of colonisation. Unfortunately, this mindset still lingers among some policymakers -  and that's a shame,"" says Vivek Dehejia, a professor of economics at Carleton University in Canada.

Many economists argue that a decade of protectionist policies has undercut Prime Minister Narendra Modi's Make in India initiative, which focused on capital and technology-intensive sectors while sidelining labour-intensive industries like textiles. As a result, the programme has struggled to deliver meaningful gains in manufacturing and exports.

""If foreigners cannot sell their goods to us, they will not have the revenues to pay for the goods they buy from us. If we cut back on their goods, they will have to cut back on ours,"" Prof Panagariya wrote.

Such protectionism has also led to allegations of cronyism.

""Tariffs have created protectionism in several Indian industries, disincentivising investments in efficiency by cosy incumbents and allowing them to steadily garner market power by building up concentrated positions,"" according to Viral Acharya, a professor of economics at New York University Stern School of Business.

With the US turning inward and China under pressure, countries belonging to the European Union are scrambling for reliable trade partners - and India could be one of them. To seize this moment, economists believe India must lower its tariffs, boost export competitiveness and signal its openness to global trade.

Sectors like garments, textiles and toys present a golden opportunity, especially for the medium and small-scale sectors. But after a decade of stagnation, the big question is: can they scale up - and will the government back them?

If Trump follows through on his tariff plans after the current pause, India could see a $7.76bn - or 6.4% - drop in exports to the US this year, according to an estimate by Global Trade Research Initiative (GTRI), a Delhi-based think tank. (In 2024, India exported $89bn worth of goods to the American market.)

""The Trump tariffs are expected to deliver a mild blow to India's merchandise exports to the US,"" says Ajay Srivastava of  GTRI.

He emphasises the need for India to broaden its trade base after securing a balanced deal with the US. This includes fast-tracking agreements with the EU, UK and Canada, while deepening ties with China, Russia, Japan, South Korea, and Asean.

At home, real impact hinges on reforms: simpler tariffs, a smoother goods and services tax (GST), better trade processes and fair implementation of quality controls. Without these, India risks missing the global moment.

Follow BBC News India on Instagram, YouTube, Twitter and Facebook.",2025-04-11T12:37:05Z
What does Trump's tariff pause mean for global trade?,"There has been a historic upheaval in American trade policy.

The announcement of Donald Trump's so-called ""reciprocal tariffs"" on 2 April - what he called ""liberation day"" - sent a shockwave through the global trading system and financial markets.

And the President's 90-day pause on some of these tariffs on 9 April set off a relief rally in stock markets.

But where has the rollercoaster of new US tariff announcements - and partial reversals - actually left the situation?

And what will it all mean for global trade?

The announced pause only applies to some of the new tariffs - taxes on imports - that Donald Trump announced on 2 April.

The new minimum 10% tariff rate, which came into effect on Saturday 5 April, is still in place for goods coming from all countries, including the UK.

There are exemptions for pharmaceuticals and microchips and some other items.

But that 10% tariff in itself is a major change in America's trading relations with all other countries.

And for China, the rate will not fall at all but will be hiked further to 125%, plus another 20% linked to the drug fentanyl.

Nevertheless, the pause means the rates above 10% for 59 other territories will be suspended until July.

That includes 46% on Vietnam, 44% on Sri Lanka and 20% on the European Union.



That's something of a relief for these nations, especially developing countries that rely heavily on manufactured goods exports to America.

Exports to the US are equivalent to 30% of Vietnam's economy and there were fears a 46% tariff would have plunged the South East Asian nation into recession.

But Vietnam and others will still be paying the new 10% minimum tariff rate when previously many were facing substantially lower levies.

And countries such as Australia and South Korea, which had free trade deals with Washington - meaning zero tariffs on many exports to the US  - will still see a major break in their trading relationships with America. They too will be subject to the 10% tariff.

The president has unilaterally torn up those free trade deals - as well as the one America had with Canada and Mexico, which Trump signed in his first term.

Numerous other tariffs Trump has announced since returning to the White House remain in place and are not affected by the pause.

That includes:

In big picture terms, economists warn the extent to which the pause actually changes the direction of overall US trade policy should not be exaggerated.

Bloomberg Economics has calculated the US's average tariff on all its imports was set to go to 27% before the pause, the highest in more than 100 years.

And after the pause they estimate it will rise to 24%, still the highest in a century.

The pause on some tariffs has made relatively little difference for two reasons.

First, because the 10% universal rate on all US imports still applies.

Second, because of the president's simultaneous hike, alongside the pause, in the tariff rate imposed on all imports from China, from 104% to 125%.

The US imported $440bn (£340bn) of goods from China in 2024, according to official US data.

That still represented around 13% of all US goods imports.

Most economists think, even after the pause, this all represents a major shift in US trade policy, which will harm the global economy.

And the intensification of the US trade war with China on top of this is expected to do further damage.

China and the US between them were projected to account for around 43% of the global economy by the International Monetary Fund in 2025.

A slowdown in both economies as a result of the trade conflict will have a knock-on negative effect on most other countries.

And economists caution that the impact of the additional uncertainty created by Trump's pause will in itself further undermine the world economy by holding back corporate investment.

Before the Trump pause, some hoped the UK could potentially benefit in some ways from the new round of Trump tariffs.

The UK's relatively lower tariff of 10% could have incentivised some multinational companies to produce more in Britain - rather than in the EU, which was facing a 20% tariff - for export to the US.

With the EU now facing the same US tariff as the UK that incentive has gone, although the UK government hopes to ultimately negotiate a free trade deal with the US to eliminate the 10% tariff.

It's also the case that the majority of the UK's exports to the US are services, rather than goods, and services are not affected by the US tariffs.

Nevertheless, the UK is now in the same position as almost every other country in the world with respect to US tariff barriers on goods.

The UK is still facing America's 25% tariff on aluminium and steel exports - and also on products derived from those metals.

The UK exported $720m (£558m) of raw steel and aluminium to America in 2024 according to United Nations data.

And calculations by the Global Trade Alert research group suggest UK exports of metal products that are exposed to these new tariffs amounted to $2.9bn in 2024.

The UK is also subject to the new blanket US 25% import tariff on cars.

Data from the Office for National Statistics shows the UK exported $9bn of cars to the US in 2024, around a quarter of its total car exports.

What do you want BBC Verify to investigate?",2025-04-11T12:37:05Z
